{
  "schema": "ucc.execution",
  "schema_version": 1,
  "id": "exec_01K0A6R4V8W6E3M4M8Y0R9J2QE",
  "created_at": "2026-08-22T12:00:00.000Z",
  "created_by": "act_01K0A6R4V8W6E3M4M8Y0R9J2QA",
  "record_version": 1,
  "node_id": "node_01K0A6R4V8W6E3M4M8Y0R9J2QX",
  "allocation_id": "nalloc_01K0A6R4V8W6E3M4M8Y0R9J2QN",
  "execution_phase": "running",
  "outcome": "unknown",
  "input_kind": "published_artifact_revision",
  "input_ref": {
    "kind": "artifact_revision",
    "id": "rev_01K0A6R4V8W6E3M4M8Y0R9J2QR",
    "content_hash": "sha256:0123456789abcdef0123456789abcdef0123456789abcdef0123456789abcdef"
  },
  "entrypoint": "run.sh",
  "args": [
    "--verbose"
  ],
  "env": {
    "ENV": "test"
  },
  "started_at": "2026-08-22T12:00:05.000Z"
}
